{
  "schema_version": "0.1-probe",
  "producer": {
    "kind": "hand-authored, script-serialised",
    "method": "docs/METHOD.md v1.0",
    "schema": "docs/CHECKER.md ontology, with the survey document's descriptive fields",
    "source_repo": "https://github.com/yzm1/heldtospec",
    "source_rev": "c8c9362",
    "source_rev_date": "2026-09-06T07:09:45Z",
    "surveyed_on": "2026-09-06",
    "component": "src/heldtospec/contracts (with cli/contract.py, docs/CONTRACTS.md, docs/CONTRACT_PROVE.md)"
  },
  "summary": {
    "promises": 44,
    "defenses": 78,
    "defenses_by_kind": {
      "checker": 7,
      "runtime_invariant": 2,
      "test": 66,
      "type": 3
    },
    "promises_with_no_defense_and_no_gap": [
      "CTR-003",
      "CTR-005",
      "CTR-037",
      "CTR-044"
    ],
    "gaps": [
      "CTR-010",
      "CTR-025",
      "CTR-026",
      "CTR-027"
    ],
    "promises_with_next_step": [
      "CTR-002",
      "CTR-003",
      "CTR-005",
      "CTR-009",
      "CTR-010",
      "CTR-011",
      "CTR-012",
      "CTR-014",
      "CTR-016",
      "CTR-018",
      "CTR-019",
      "CTR-021",
      "CTR-032",
      "CTR-037",
      "CTR-038",
      "CTR-041",
      "CTR-044"
    ],
    "bindings": 0,
    "evidence_records": 0,
    "note": "Every defense is unbound: no evidence record exists for any of them. A test named here is a test that was read, not one that was graded by mutation; a checker named here was read, not audited by a seeded violation. See README."
  },
  "promises": [
    {
      "id": "CTR-001",
      "text": "`contract lint` validates the model and rejects unknown or misspelled keys, without loading the dataset.",
      "subject_scope": "src/heldtospec/contracts/models.py",
      "source": "docs/CONTRACTS.md:67-68",
      "published_in": [
        "docs/CONTRACTS.md"
      ],
      "confidence": "verified",
      "why": "A misspelled key is a promise that silently went missing; the models.py header lists four that once loaded clean.",
      "defenses": [
        {
          "guarded_by": "type",
          "artifact_locator": "src/heldtospec/contracts/models.py:16",
          "why_this_kind": "`_STRICT = ConfigDict(extra=\"forbid\")` on every model makes an unknown key unrepresentable rather than ignored.",
          "id": "CTR-001:d0",
          "promise_id": "CTR-001",
          "subject_scope": "src/heldtospec/contracts/models.py"
        },
        {
          "guarded_by": "test",
          "artifact_locator": "tests/cli/test_contract_workflow.py::test_lint_rejects_a_broken_contract",
          "why_this_kind": "Exercises the CLI path on one broken contract.",
          "id": "CTR-001:d1",
          "promise_id": "CTR-001",
          "subject_scope": "src/heldtospec/contracts/models.py"
        }
      ],
      "the_test_that_would_catch_it": "A contract with `nullible: false` loading without error."
    },
    {
      "id": "CTR-002",
      "text": "`max_null_percentage` is a fraction in [0, 1]; a value such as 50 is rejected.",
      "subject_scope": "src/heldtospec/contracts/models.py::CompletenessSLA",
      "source": "docs/CONTRACTS.md:58; models.py:86-89",
      "published_in": [
        "docs/CONTRACTS.md"
      ],
      "confidence": "verified",
      "why": "Unbounded, `50` became a limit of 5000 against a 0-100 metric and the SLA could never fail.",
      "defenses": [
        {
          "guarded_by": "type",
          "artifact_locator": "src/heldtospec/contracts/models.py:89",
          "why_this_kind": "`Field(ge=0.0, le=1.0)`; the compiler of the model refuses the value.",
          "id": "CTR-002:d0",
          "promise_id": "CTR-002",
          "subject_scope": "src/heldtospec/contracts/models.py::CompletenessSLA"
        }
      ],
      "the_test_that_would_catch_it": "A contract declaring `max_null_percentage: 50` accepted by lint.",
      "next_step": "No test in the contracts or CLI suites submits an out-of-range value; locate one elsewhere or record that the type is the only defense."
    },
    {
      "id": "CTR-003",
      "text": "Duration units for `max_age` are s, m, h and d.",
      "subject_scope": "src/heldtospec/contracts/mapper.py::parse_duration",
      "source": "docs/CONTRACTS.md:59; mapper.py:104-125",
      "published_in": [
        "docs/CONTRACTS.md"
      ],
      "confidence": "verified",
      "why": "A misparsed freshness limit is a gate that fires always or never.",
      "defenses": [],
      "the_test_that_would_catch_it": "`parse_duration('1w')` accepted, or `'90'` silently read as ninety seconds without the doc saying so (it is: a bare number parses as seconds, undocumented).",
      "next_step": "No test of `parse_duration` found in the contracts or CLI suites. Note also that `metrics/temporal.py` has a second duration parser accepting w/ms/us/ns; the two grammars differ and nothing says which a contract author gets."
    },
    {
      "id": "CTR-004",
      "text": "`verify` compiles each declaration in the documented table to its named check: type to schema_match, nullable to null share 0, unique to uniqueness 100, allowed_values to outside-count 0, min/max to value_range, regex to match 100, freshness to freshness_check, min_rows to row_count, max_null to a per-column null limit, expr to expr_check.",
      "subject_scope": "src/heldtospec/contracts/mapper.py::contract_to_checks",
      "source": "docs/CONTRACTS.md:76-89; mapper.py:128-376",
      "published_in": [
        "docs/CONTRACTS.md"
      ],
      "confidence": "verified",
      "why": "This table is the whole meaning of `verify`; a row that does not compile is a published guarantee nothing tests.",
      "defenses": [
        {
          "guarded_by": "test",
          "artifact_locator": "tests/contracts/test_which_promises_reach_the_runner.py::test_every_column_promise_is_discharged_by_a_tagged_check",
          "why_this_kind": "Asserts each column promise is claimed by a compiled check.",
          "id": "CTR-004:d0",
          "promise_id": "CTR-004",
          "subject_scope": "src/heldtospec/contracts/mapper.py::contract_to_checks"
        },
        {
          "guarded_by": "test",
          "artifact_locator": "tests/contracts/test_which_promises_reach_the_runner.py::test_schema_match_answers_every_column_type_at_once",
          "why_this_kind": "The one-check-many-clauses case.",
          "id": "CTR-004:d1",
          "promise_id": "CTR-004",
          "subject_scope": "src/heldtospec/contracts/mapper.py::contract_to_checks"
        },
        {
          "guarded_by": "runtime_invariant",
          "artifact_locator": "src/heldtospec/contracts/mapper.py:532-586",
          "why_this_kind": "`compile_contract` reconciles the clause register against the emitted checks on every lint, verify and prove, and reports any clause that compiled to nothing. It runs where the product runs and cannot see a defect before a contract exercises it.",
          "id": "CTR-004:d2",
          "promise_id": "CTR-004",
          "subject_scope": "src/heldtospec/contracts/mapper.py::contract_to_checks"
        }
      ],
      "the_test_that_would_catch_it": "A ClauseKind added to the enumerator and not to the compiler, with lint reporting nothing."
    },
    {
      "id": "CTR-005",
      "text": "Foreign-key `references` is contract metadata in the current verifier and is not enforced.",
      "subject_scope": "src/heldtospec/contracts/mapper.py::_column_checks",
      "source": "docs/CONTRACTS.md:91-92",
      "published_in": [
        "docs/CONTRACTS.md"
      ],
      "confidence": "verified",
      "why": "This published sentence is now false: mapper.py:186-210 compiles `references` to `referential_integrity` when a parent is supplied, and CONTRACT_PROVE.md documents that. The page in the mkdocs nav promises the opposite of what the code does, and the enforced-check table above it omits the row.",
      "defenses": [],
      "the_test_that_would_catch_it": "A sweep that reads CONTRACTS.md's enforced-check table and asserts every compiled clause kind has a row, and every 'is metadata' claim names a kind that compiles to nothing. The existing rendering checker covers three other documents and not this one.",
      "next_step": "Correct the sentence and the table, add `references`, `--reference`, `--strict` and `accepted:`; then add CONTRACTS.md to the rendering sweep or write its own."
    },
    {
      "id": "CTR-006",
      "text": "A bare `checks[].metric` has no pass condition and cannot gate; it is enumerated as a promise and reported, not dropped.",
      "subject_scope": "src/heldtospec/contracts/clauses.py::enumerate_clauses",
      "source": "docs/CONTRACTS.md:92-94; clauses.py:296-308; mapper.py:359-367",
      "published_in": [
        "docs/CONTRACTS.md"
      ],
      "confidence": "verified",
      "why": "A check that cannot fail is the vacuity shape; enumerating it is what keeps it visible.",
      "defenses": [
        {
          "guarded_by": "test",
          "artifact_locator": "tests/contracts/test_which_promises_reach_the_runner.py::test_a_promise_that_cannot_be_kept_is_still_a_promise",
          "why_this_kind": "The inert check appears in the register.",
          "id": "CTR-006:d0",
          "promise_id": "CTR-006",
          "subject_scope": "src/heldtospec/contracts/clauses.py::enumerate_clauses"
        },
        {
          "guarded_by": "runtime_invariant",
          "artifact_locator": "src/heldtospec/contracts/mapper.py:360-367",
          "why_this_kind": "`logger.warning` at compile time. The older, weaker defense: it alarms where it runs, to a channel that scrolls past.",
          "id": "CTR-006:d1",
          "promise_id": "CTR-006",
          "subject_scope": "src/heldtospec/contracts/clauses.py::enumerate_clauses"
        }
      ],
      "the_test_that_would_catch_it": "A `checks:` entry with only `metric:` compiling to a passing check."
    },
    {
      "id": "CTR-007",